{
  "$schema": "https://json-schema.org/draft/2020-12/schema",
  "$id": "https://schemas.cdsoft.com.cn/vastplan/composition/frontend/v1/vastplan.platform-profile.schema.json",
  "title": "VastPlan Frontend Platform Profile v1",
  "type": "object",
  "additionalProperties": false,
  "required": ["version", "revision", "id", "target", "designSystem", "plugins", "security"],
  "properties": {
    "version": { "$ref": "https://schemas.cdsoft.com.cn/vastplan/composition/common/v1/vastplan.composition-common.schema.json#/$defs/version" },
    "revision": { "$ref": "https://schemas.cdsoft.com.cn/vastplan/composition/common/v1/vastplan.composition-common.schema.json#/$defs/revision" },
    "id": { "$ref": "https://schemas.cdsoft.com.cn/vastplan/composition/common/v1/vastplan.composition-common.schema.json#/$defs/compositionId" },
    "target": { "type": "object", "additionalProperties": false, "required": ["kernel"], "properties": { "kernel": { "const": "frontend" } } },
    "designSystem": { "$ref": "#/$defs/designSystem" },
    "plugins": { "type": "array", "minItems": 1, "items": { "$ref": "#/$defs/pluginRef" } },
    "security": {
      "type": "object", "additionalProperties": false,
      "required": ["firstPartyOnly", "requireIntegrity"],
      "properties": { "firstPartyOnly": { "const": true }, "requireIntegrity": { "const": true } }
    }
  },
  "$defs": {
    "pluginRef": {
      "type": "object", "additionalProperties": false, "required": ["id", "version"],
      "properties": {
        "id": { "$ref": "https://schemas.cdsoft.com.cn/vastplan/common/v1/identifiers.schema.json#/$defs/pluginId" },
        "version": { "$ref": "https://schemas.cdsoft.com.cn/vastplan/common/v1/identifiers.schema.json#/$defs/semver" },
        "channel": { "$ref": "https://schemas.cdsoft.com.cn/vastplan/common/v1/identifiers.schema.json#/$defs/channel", "default": "stable" }
      }
    },
    "designSystem": {
      "type": "object", "additionalProperties": false, "required": ["id", "version", "uiContract"],
      "properties": {
        "id": { "$ref": "https://schemas.cdsoft.com.cn/vastplan/common/v1/identifiers.schema.json#/$defs/pluginId" },
        "version": { "$ref": "https://schemas.cdsoft.com.cn/vastplan/common/v1/identifiers.schema.json#/$defs/semver" },
        "channel": { "$ref": "https://schemas.cdsoft.com.cn/vastplan/common/v1/identifiers.schema.json#/$defs/channel", "default": "stable" },
        "uiContract": { "type": "string", "minLength": 1, "maxLength": 128 }
      }
    }
  }
}
