{
  "version": 1,
  "revision": 1,
  "id": "portal-default",
  "target": { "kernel": "frontend" },
  "designSystem": {
    "id": "com.vastplan.foundation.frontend.design-system.arco",
    "version": "1.0.0",
    "channel": "stable",
    "uiContract": "^1.0.0"
  },
  "plugins": [
    { "id": "com.vastplan.foundation.frontend.design-system.arco", "version": "1.0.0", "channel": "stable" },
    { "id": "com.vastplan.platform.configuration.portal-composer", "version": "1.0.0", "channel": "stable" },
    { "id": "com.vastplan.platform.configuration.global-settings", "version": "0.2.0", "channel": "stable" },
    { "id": "com.vastplan.platform.security.credentials", "version": "0.2.0", "channel": "stable" },
    { "id": "com.vastplan.platform.data.relational.connection-manager", "version": "0.2.0", "channel": "stable" },
    { "id": "com.vastplan.platform.artifacts.repository", "version": "0.2.0", "channel": "stable" }
  ],
  "security": { "firstPartyOnly": true, "requireIntegrity": true }
}
